[
  {
    "id": "corbits",
    "name": "Corbits",
    "url": "https://corbits.dev",
    "repo": null,
    "category": "solana",
    "chain": "multi",
    "description": "Production multi-network, multi-token x402 facilitator covering EVM chains and Solana.",
    "status": "active",
    "added": "2026-10-10"
  },
  {
    "id": "dexter-facilitator",
    "name": "Dexter Facilitator",
    "url": "https://dexter.cash/facilitator",
    "repo": null,
    "category": "solana",
    "chain": "multi",
    "description": "Public x402 facilitator that settles payments across Solana and EVM networks through a single endpoint with no facilitator fee.",
    "status": "active",
    "added": "2026-10-10"
  },
  {
    "id": "erpc-x402",
    "name": "eRPC x402 Solana endpoint",
    "url": "https://x402.erpc.global/doc",
    "repo": null,
    "category": "solana",
    "chain": "solana",
    "description": "Paid Solana mainnet JSON-RPC endpoint that charges per method over x402, settled in USDC.",
    "status": "early",
    "added": "2026-10-10"
  },
  {
    "id": "faremeter",
    "name": "Faremeter",
    "url": "https://github.com/faremeter/faremeter",
    "repo": "https://github.com/faremeter/faremeter",
    "category": "solana",
    "chain": "multi",
    "description": "Framework that lets agents and utilities make machine payments over web infrastructure, with Solana and EVM payment support.",
    "status": "active",
    "added": "2026-10-10"
  },
  {
    "id": "kora",
    "name": "Kora",
    "url": "https://solana.com/docs/tools/kora",
    "repo": "https://github.com/solana-foundation/kora",
    "category": "solana",
    "chain": "solana",
    "description": "Solana signing service for gasless transactions that lets users pay fees in tokens like USDC instead of SOL; usable as an x402 reference facilitator.",
    "status": "active",
    "added": "2026-10-10"
  },
  {
    "id": "pay-sh",
    "name": "Pay",
    "url": "https://pay.sh",
    "repo": "https://github.com/solana-foundation/pay",
    "category": "solana",
    "chain": "solana",
    "description": "CLI and gateway for paying HTTP 402-gated APIs with Solana stablecoins from a local wallet, over x402 and MPP.",
    "status": "early",
    "added": "2026-10-10"
  },
  {
    "id": "payai-facilitator",
    "name": "PayAI Facilitator",
    "url": "https://facilitator.payai.network",
    "repo": "https://github.com/PayAINetwork/x402-solana",
    "category": "solana",
    "chain": "multi",
    "description": "Live x402 facilitator that verifies and settles stablecoin payments on Solana, Base, Polygon, Avalanche, Arbitrum, Sei, X Layer, and SKALE.",
    "status": "active",
    "added": "2026-10-10"
  },
  {
    "id": "quicknode-x402",
    "name": "Quicknode x402",
    "url": "https://www.quicknode.com/x402",
    "repo": null,
    "category": "solana",
    "chain": "multi",
    "description": "Pay-per-request blockchain RPC across 75+ chains billed in stablecoins from a wallet, with no sign-up or API key.",
    "status": "active",
    "added": "2026-10-10"
  },
  {
    "id": "solana-agent-kit",
    "name": "Solana Agent Kit",
    "url": "https://github.com/sendaifun/solana-agent-kit",
    "repo": "https://github.com/sendaifun/solana-agent-kit",
    "category": "solana",
    "chain": "solana",
    "description": "Open-source toolkit that connects AI agents to Solana protocols, including token transfers and swaps.",
    "status": "active",
    "added": "2026-10-10"
  },
  {
    "id": "solana-pay",
    "name": "Solana Pay",
    "url": "https://docs.solanapay.com",
    "repo": "https://github.com/solana-labs/solana-pay",
    "category": "solana",
    "chain": "solana",
    "description": "Open-source standard and reference implementations for decentralized payments on Solana, with a published specification.",
    "status": "active",
    "added": "2026-10-10"
  },
  {
    "id": "solana-x402-guide",
    "name": "Solana x402 developer guide",
    "url": "https://solana.com/docs/payments/agentic-payments/intro-to-x402",
    "repo": null,
    "category": "solana",
    "chain": "solana",
    "description": "Official Solana documentation for building x402 sellers and buyers with the SVM exact scheme, Express middleware, and fetch wrappers.",
    "status": "active",
    "added": "2026-10-10"
  },
  {
    "id": "solana-x402-facilitator-docs",
    "name": "Solana x402 facilitator guide",
    "url": "https://solana.com/docs/tools/x402-facilitator",
    "repo": null,
    "category": "solana",
    "chain": "solana",
    "description": "Official Solana guide comparing managed, self-hosted, and in-process x402 verification and settlement.",
    "status": "active",
    "added": "2026-10-10"
  },
  {
    "id": "solvador",
    "name": "Solvador",
    "url": "https://solvador.com",
    "repo": null,
    "category": "solana",
    "chain": "multi",
    "description": "Multi-network x402 facilitator settling on EVM chains, Solana, and NEAR with support for multiple schemes and extensions.",
    "status": "active",
    "added": "2026-10-10"
  },
  {
    "id": "a2a-x402",
    "name": "A2A x402 Extension",
    "url": "https://github.com/google-agentic-commerce/a2a-x402",
    "repo": "https://github.com/google-agentic-commerce/a2a-x402",
    "category": "protocols",
    "chain": "multi",
    "description": "Extension that brings x402 cryptocurrency payments to the A2A protocol so agents can monetize their services.",
    "status": "early",
    "added": "2026-10-10"
  },
  {
    "id": "ap2",
    "name": "Agent Payments Protocol (AP2)",
    "url": "https://ap2-protocol.org",
    "repo": "https://github.com/google-agentic-commerce/AP2",
    "category": "protocols",
    "chain": "none",
    "description": "Open protocol for agent-led payments that uses cryptographically signed mandates to record a user's authorization.",
    "status": "active",
    "added": "2026-10-10"
  },
  {
    "id": "a2a",
    "name": "Agent2Agent (A2A)",
    "url": "https://a2a-protocol.org",
    "repo": "https://github.com/a2aproject/A2A",
    "category": "protocols",
    "chain": "none",
    "description": "Open standard for agents built on different frameworks to discover each other's abilities and collaborate, overseen by the Linux Foundation.",
    "status": "active",
    "added": "2026-10-10"
  },
  {
    "id": "mpp",
    "name": "Machine Payments Protocol",
    "url": "https://mpp.dev",
    "repo": "https://github.com/tempoxyz/mpp",
    "category": "protocols",
    "chain": "multi",
    "description": "Open standard for machine-to-machine payments over HTTP 402, with SDKs in TypeScript, Python, Rust, Go, and Ruby and many payment methods.",
    "status": "active",
    "added": "2026-10-10"
  },
  {
    "id": "mppx",
    "name": "mppx",
    "url": "https://github.com/wevm/mppx",
    "repo": "https://github.com/wevm/mppx",
    "category": "protocols",
    "chain": "multi",
    "description": "TypeScript interface for the Machine Payments Protocol.",
    "status": "active",
    "added": "2026-10-10"
  },
  {
    "id": "tempo",
    "name": "Tempo",
    "url": "https://tempo.xyz",
    "repo": null,
    "category": "protocols",
    "chain": "multi",
    "description": "Blockchain built for stablecoin payments that also promotes MPP for AI agents paying API services.",
    "status": "active",
    "added": "2026-10-10"
  },
  {
    "id": "x402",
    "name": "x402",
    "url": "https://www.x402.org",
    "repo": "https://github.com/x402-foundation/x402",
    "category": "protocols",
    "chain": "multi",
    "description": "Open HTTP-native payment protocol using the 402 status code, with TypeScript, Python, Go, and Java SDKs and support for EVM, Solana, and Stellar.",
    "status": "active",
    "added": "2026-10-10"
  },
  {
    "id": "x402-docs",
    "name": "x402 documentation",
    "url": "https://docs.x402.org",
    "repo": "https://github.com/x402-foundation/x402",
    "category": "protocols",
    "chain": "multi",
    "description": "Official x402 docs, including the specification, facilitator directory, and curated third-party SDKs and extensions.",
    "status": "active",
    "added": "2026-10-10"
  },
  {
    "id": "acp",
    "name": "Agentic Commerce Protocol (ACP)",
    "url": "https://www.agenticcommerce.dev",
    "repo": "https://github.com/agentic-commerce-protocol/agentic-commerce-protocol",
    "category": "agentic-commerce",
    "chain": "none",
    "description": "Open standard co-created by Stripe and OpenAI for coordinating purchases between buyers, agents, and businesses and passing payment credentials.",
    "status": "active",
    "added": "2026-10-10"
  },
  {
    "id": "link-agents",
    "name": "Link for agents",
    "url": "https://link.com/agents",
    "repo": null,
    "category": "agentic-commerce",
    "chain": "none",
    "description": "Link wallet for AI agents that makes purchases on a user's behalf with each amount approved in advance.",
    "status": "active",
    "added": "2026-10-10"
  },
  {
    "id": "mastercard-agent-pay",
    "name": "Mastercard Agent Pay",
    "url": "https://mastercard.com/gb/en/news-and-trends/press/2025/september/mastercard-unveils-new-tools-and-collaborations-to-power-smarter.html",
    "repo": null,
    "category": "agentic-commerce",
    "chain": "none",
    "description": "Mastercard program for agent-initiated card payments, announced alongside an Agent Toolkit and tools for agent sign-up and insight tokens.",
    "status": "active",
    "added": "2026-10-10"
  },
  {
    "id": "paypal-agent-toolkit",
    "name": "PayPal Agent Toolkit",
    "url": "https://developer.paypal.com/community/blog/paypal-agentic-ai-toolkit/",
    "repo": null,
    "category": "agentic-commerce",
    "chain": "none",
    "description": "PayPal toolkit and remote MCP server exposing payments, invoices, disputes, subscriptions, and reporting APIs to AI agent frameworks.",
    "status": "active",
    "added": "2026-10-10"
  },
  {
    "id": "stripe-agentic-commerce",